{
  "schema": "ascendop.native-turn-outcome.v1",
  "action_id": "actor-action-demo-1",
  "native_session_id": "thread-solver-demo",
  "native_turn_id": "turn-solver-demo-1",
  "terminal_status": "completed",
  "structured_result": {"schema": "ascendop.agent-action-outcome.v1"},
  "artifact_refs": [".ascendop-output/candidate-proposal.json"],
  "telemetry": {"usage": {}, "skills": {}},
  "observed_at": "2026-08-17T00:10:00Z"
}
